page,name,rate,time,IP,favor,comment
6,浮游海月,1,2024/1/11 0:08,天津,165,还是从影视区吐槽来的。唉，这么多年过去了，女观众们还是吃这套虐女向的东西。因为女主很惨所以在权力上位的男的们都心痛追悔莫及，也就是以虐待弱者来让强者后悔心疼，于是代入弱者女主的观众们就爽了就高潮了。我真……好在已经有越来越多的女性已经清醒过来批判这种趣味和无意识了。
6,Sunshine,5,2023/8/26 9:57,辽宁,14,get到张晚意了，太喜欢玱玹了！（这个字太难打了，拼qiang能找到）檀健次的演技一如既往的稳，眼睛会说话，只靠微表情就能展现人物丰富的情感，表演真的很细腻。我觉得小夭对相柳是有心动的。
6,zhdd,5,2024/2/12 19:46,广东,5,好剧。被极其理性、自立自强的女性角色迷倒，再看作者居然是桐华。学生时期看过桐华的《那些回不去的年少时光》，就惊叹桐华怎么把少女暗恋人的心态写得如此细腻。
6,feeling,4,2023/10/1 16:42,江苏,55,对涂山璟真的又爱又恨啊，有无数的优点却有一个致命的缺点，要么梅林虐杀同死结束，要么复活HE，怎么后面搞了一个退不了的婚还结婚生子了，真想让苍玹直接刀了他。演员得角色来成就的，之前看的剧里有邓为都没留下深刻的印象，但是这部剧里get了，喜欢的人都有同款小开扇双眼皮，他也很适合古装装造。
6,xiaobai,5,2024/4/22 10:19,湖北,4,小狐狸！在韩硕之后入坑的男人又来了。就之前播的时候就追了的，然后现在二刷，居然熬了个大夜一口气看完了，这又是优秀男朋友天花板了吧，高、白、瘦、有钱、情绪稳定、温柔体贴、无条件答应，哇，还会各种茶艺，这谁顶得住啊，当然另外两位也不错，但是轮颜值排序，搞事业的表哥无论如何都在最后。。咋呢，事业不能丢，爱情也不想放，得不到就毁掉，这样的男主除非长得帅哈，否则该死。。总之无脑喜欢
6,?,4,2024/3/16 17:02,安徽,1,继东宫后看过最好看的古偶各方面都非常非常好
6,一大朵,3,2024/2/5 13:27,重庆,20,相柳竟然不是男一，弃。
6,Amenemu,4,2024/3/7 21:46,上海,10,除了开头设定太多，后期因为几位主演的演技和不算太离谱的剧情发展还是挺好看的。第一次看檀健次演戏，好伟大的相柳?（
6,吴京直肠倒模,4,2024/2/18 21:33,浙江,14,4星全给清水镇，其他的都是些啥啊.....又拖又纠结，然后请问邓为是在演一根木头吗？
6,柚子,2,2024/1/21 0:58,浙江,23,朋友安利的一定要我看看结果：实在很难看低成本古偶剧看到二十集实在受不了弃了一分钟都不想多浪费时间了
6,goldlya,3,2023/8/25 13:52,湖北,21,下饭剧。这种慢调调的讲故事的方法挺特别的，配乐很细腻，也很熟悉，就很古的感觉，就是有的演员演的不细腻
6,Sù,4,2024/4/4 22:20,江苏,3,选角贴切，演技精湛，制作精良，清水镇原来是耗费数月搭建而成，布景精致入微。一直到兄妹相认，之前的愤懑不满才有所改观，剧情太虐。“喜乐不尽兴，悲忧不尽情”，小夭的人生观深有共情，不忍泪目。但多角恋的纠葛实在不堪如此拖泥带水。热切期待第二季小夭真正站起来！
6,momo,3,2023/9/20 14:55,北京,100,出了清水镇女主就强行降智了，越长大越觉得桐华的书内核虐女
6,大狐狸,4,2023/8/15 3:10,重庆,1,没人会不爱忠犬狗狗！拍得很好，感情渐入佳境。杨紫演技好。后面剧情无聊了点，套路化。三男一女随时修罗场。我爱小狐狸?为小狐狸打五星！！！！！“姐姐”“是你的吻甜”“好”啊啊啊啊啊啊啊简直了好久没这么狂热地实时追剧了梅林戏没拍好?剪辑和配乐的问题。这个时候不加回忆挤观众的眼泪在干啥呢？权谋很弱…其实苍玄做的一切只是要通过爷爷的考验。但他确实适合做国君。张晚意演技好，人也很好。我可怜的小狐狸?我可怜的小夭?相柳也挺可怜…唉。关于这部剧看过很多解说和分析，情感很细腻，人物心理有据可依。弱在情节的推动老套生硬节奏慢。
6,水蜜桃汽水,4,2023/8/27 10:48,湖北,249,该说不说，紫的演技确实可以。
7,达野风,2,2023/9/23 14:19,北京,25,东拉西扯到底讲什么？？？
7,Eliane,3,2023/8/4 17:18,黑龙江,488,如果这个身份不能陪你，那就换个身份来爱你，夭柳我哭死
7,南山南酱,未知,2023/12/12 17:11,北京,2,把背景改成现代简直过于狗血老套。
7,Echooo,5,2023/8/24 9:33,江苏,1891,我就站相柳。
7,西梅小苑子,5,2024/4/24 16:38,浙江,3,相柳天蝎涂山璟双鱼也太典型了
7,兔子,4,2024/1/5 15:36,北京,34,两分给檀健次，演太好了！官配磕不起来，随便一个男配都好过男主啊。。。。男装部分挺好看的，换女装后剧情开始做作。防风邶（相柳）太爱了，虽然口是心非的傲娇和内心的自卑让他错失女主。
7,天降奇财,4,2024/3/2 19:07,黑龙江,3,古代的神仙和现代的人相比，除了寿命长一些，其他都比较落后，没有手机也没有医疗美容科，有事时也不能及时通知看完了，挺好看
7,安和桥伴奏,4,2023/8/4 17:22,湖北,767,那些爱过的证据，在相认的时候都成为了刺，夭玹太有宿命感了
7,加特林小水滴,4,2024/4/21 4:34,辽宁,1,我觉得还挺好看的，我一般不乐意看这种扯淡的剧，但是我觉得看了看，还行，布景什么还挺不错的
7,晶辰莹星,3,2024/4/2 19:29,河南,1,好虐但大方的给了三个现实中见不到的深情依然是童话
7,吴钩子,4,2023/12/14 1:05,美国,47,每日一问，小夭为什么不爱相柳
7,Gold Snow,4,2024/1/20 14:41,北京,18,作为大女主兼玄幻言情剧，如何判断四位男主的轻重份量？不是表面的卿卿我我，也不是旁人所见的戚戚相依，而是灵魂深处的共鸣，跨越生死的陪伴，执手赏圆月，并肩游海底，共种情人蛊，陪练射箭术，独立共成长，无奈长相思。相柳的爱，深沉又高级。
7,幼稚园新童鞋,4,2023/8/11 22:27,上海,1389,夭柳党，意难平。
7,奇锅,5,2023/9/28 6:07,德国,23,好看好磕
7,税控AT,4,2024/2/27 22:07,吉林,4,还不错，能看进去
7,Rachel,4,2024/2/2 16:51,江苏,4,虽然总体还可以，但是还是对所有男主都爱女主爱得死去活来的剧情欣赏无能
7,阳朱,3,2023/8/7 14:20,北京,886,E9。开篇漫长的狗血前史（表兄妹、两个人家长陆续惨死，临死都向小孩托孤让“互相照顾”），成年后仿佛一女n男的rpg恋爱游戏。女扮男装成药剂师的女主，救了家世显赫的重伤男狐；制药技能引起男三敌国大妖将军注意，要求定期提供毒药，以及吸血服务；男一表哥忍辱负重四处寻找女主，也在小镇落脚，却为了替身妹妹伤害女主…三个男的轮番出场和女主或虐或甜。三种cp模式，颇不讲武德（表兄妹-真假美人鱼or黑白天鹅；九头妖-吸血鬼式危险情人；狐妖-狐狸报恩+忠诚男仆）。好处是女主成年后人设有点意思且一以贯之（estp，现实、满不在乎），几个男主也算有机联系，代表不同国家势力杀来杀去，让女主难做人。选角拖后腿：表哥需要极深的自咎却找了气质轻慢的演员；九头妖需要高大却找了矮子。
7,迷离君·°?,3,2024/1/5 1:56,江苏,1,后面变low了
7,桃支,5,2023/10/23 22:32,福建,63,先说结论，感情戏真的处处名场面，权谋部分弱的很儿戏。相柳太绝，危险又迷人，和小夭的那种互相吸引，宿命般的拉扯感太戳我，那头白发也是点睛之笔。叶十七也很好，非常好，善良温柔又包容体贴，所以当他被世俗束缚成涂山璟，他的挣扎和无力更让人揪心了。两个男人都很好，小夭不可以左拥右抱吗？！骨科我还是有点不行，哥哥是好哥哥，就是一直需要小夭保护，太不争气！
7,黑岩funky,5,2024/2/6 21:27,北京,32,感谢檀哥演了相柳。从此我是相柳的追随者，檀哥的炭火。感谢2023年的相遇～
8,这个手刹不太灵,5,2023/8/6 16:40,广西,4927,太爱九命相柳了檀健次演技好好！我好爱！
8,T、S,3,2023/8/3 10:27,吉林,9,因为我是看过小说的，杨紫变回小夭剧情就越来越不好看了。张晚意没看出啥亮点，相柳演的还行，代露娃还行，邓为演技差点意思，前期叶十七很好。变回涂山璟演技直接灾难式大崩。整体高开低走，后面真差点弃剧了，特效十分歹毒，钱哪去了？为了省经费把烈阳和阿獙这俩神兽删了！太难受了，神话改编没有跟山海经靠边的概设特效，水龙头流血创飞我了，高能梅林场面也假得不可思议。
8,林帛,4,2023/10/2 15:01,上海,18,其实还是几男都爱我的老套路。但，不得不说，在这真情稀缺的年代，叶十七这样的男设，依旧能一个老阿姨嘴角上扬。我们其实都跟小夭一样，什么都知道、也会自己扛。但如果遇到这样的人，依旧会无法抗拒。这是人性，最真切的对温暖依恋信任的渴求。不过如果真的要写大女主剧，还是应该让涂山璟后面也不再一味等待，他也会离开。就像小六说的，没有人会一直等待。这才是，这个年代人心最真实的样貌：）我貌似太狠了点。算了，还是让十七陪着小六吧。
8,笙笙。,4,2024/1/9 19:49,浙江,14,炎黄之争、诸神之战、戎马倥偬、逐鹿中原，宏大的上古神话史作叙事背景，就决定了《曾许诺》与《长相思》不可能是二流小说。可喜的看到剧版做到了完全地的还原，哪怕最为夭柳党也被张晚意的演技折服，他是当之无愧的男主，因为虽然女主有三条感情线，但整部剧却是已黑帝登上皇位一统天下为背景的。为相柳心痛十几年，看了剧更加心痛，“天上鹣鲽不独飞，水中鸳鸯会双死”，爱极必伤，情深不寿，相柳是真正践行了阿珩说的“如不守诺何必许诺”。过了十多年终于渐渐懂了，小夭和他正如小夭父母，是注定无法在一起的，这就是极致的BE美学。
8,拜见冥王,3,2023/8/27 15:57,北京,34,前18集有意思，关于因爱而生的错误，相当于猫妈妈的毒奶。小幺的“不要等待”论也蛮符合当下人的思维：不去爱，就不会有伤害。人物关系是复杂的，立体的，就问哪个男主能像张晚意这般又正直又招人恨？18集后又是庙堂阴谋腹黑论那套，落入俗套。
8,坂本枏一,5,2023/7/25 2:53,河南,3704,牛掰死了，头一次看到编剧手里这么不值钱的女主。三个男主真的都很疯p，好久都没过好奇过一个剧后面该咋演了，希望上下季一定得连播啊
8,青苹果,4,2024/1/17 19:13,,15,荡气回肠，女性感情的三个层次，最高境界，也许是相柳的，那就注定不能完美
8,Alphaeus,4,2023/8/8 14:13,上海,1633,被多方安利看了一眼，入坑……哇，杨紫真的是旺男主，每对cp都好磕～～～三位男演员，演技在线，气质出众，个性鲜明，太难得了……
8,渔舟唱晚,1,2024/4/11 11:54,河北,56,又是一个丑女配三个帅哥，心疼男演员，对着一张硅胶脸怎么下得了嘴
8,栗子李,3,2023/8/31 10:45,安徽,36,刚看的时候觉得很还原，但是吧，它好像把每个观众都当成了读过原著深知剧情的书粉，各种剧情走马观花一样匆匆一瞥，太轻描淡写了，那些深刻的情感就显得很奇怪还是很不喜欢涂山璟。当年看书，一直当表哥是路人配角哈哈哈哈，相柳我也当无竞争力男配的，那时候年纪小，哪知道除了男女主还能这么嗑
8,王一雕,3,2023/8/27 15:02,浙江,240,看过b站的相柳cut以后垂直入坑檀健次！
8,每天都要喝牛奶,3,2024/1/9 19:06,四川,4,越往後看越心累
8,才下眉头,4,2024/2/12 18:39,美国,11,在人声鼎沸时，想必相柳已习惯一个人落寞。礼花声中，向我的孤勇英雄敬上一杯，去他的道德礼法、功名富贵！世人皆爱慕虚荣，而世间最孤寂加我一人，陪你到尽头。
8,Winterm?rchen,4,2024/1/10 0:09,北京,16,十年前的小说粉延迟打卡，小夭认错母亲的场景真是神还原，赚足了我的眼泪。确实get到了杨紫的演技，同时感谢这部剧让我pick了张晚意和檀健次！玱玹真的要感谢张晚意，如果不是他来演，不知道会被骂的多惨，而晚意确实能顶得住特写大镜头，丰富的眼神戏一下子就把玱玹的内心交代了，戳人心窝子，更别提那台词和声音了，圈粉妥妥的。相柳就不说了，原著中最爱的人物，感谢檀健次演活了相柳和防风邶。整部剧比书写的视角好很多，唯一不足的是有些大场面的戏明显导演功力不足没hold住。还有实在讨厌防风意映的那些戏。。。
8,岚小壹时光琐碎,5,2023/8/24 10:35,湖北,926,啊啊啊啊啊啊我的宝宝蛇啊啊啊啊啊我的宝宝邶！！！！！！！！！！！！！紫妹一拖三能力不是盖的，前期演男生我也想不出还有哪个小花能演的比他好，这部戏我终于get到檀健次了，相柳人物属性加成再加上檀健次那会说话的眼睛，真的有好好琢磨人物进行好的演技尝试，成就了相柳也成就了檀健次！！！美强惨谁不爱啊！！！
8,多丽多丽,4,2023/11/2 20:28,广东,5,能把这部剧看完全凭几位演员撑着，其实这部剧剧情挺水的，罗里吧嗦很冗长。ps.檀健次的相柳扮相还挺吸睛！
8,OREO,5,2023/9/21 23:06,北京,19,看上瘾了
8,高筱筱,5,2023/7/31 11:10,北京,2705,邓为，张晚意，檀健次古装真的太可！！！
8,晚风云意,5,2023/8/29 16:02,吉林,283,涂山璟太迷人了吧
8,智盎,4,2023/7/28 11:04,广东,2032,我璟不像其他男主专搞事业，只想纯纯当个小娇七，守在小六身边，他就像是老天赐给小六的礼物，永远不离不弃，相伴相依
9,七號風球,3,2023/8/24 9:48,贵州,30,破命运的谜语
9,有志者事竟成,4,2023/12/30 21:48,江西,5,重过程的剧，很精彩。
9,未琢 ?,2,2024/2/26 22:49,辽宁,9,一女四男，玛丽苏古偶，前期太虐，毒点太多了，相柳拧巴的点让人反感，恋爱线太多了，价值观乱七八糟，真是狗血加反人类了。
9,Sally,4,2023/10/11 10:48,美国,27,这部剧作为一部古偶拍得很不错。故事性和人物塑造都很成功。甚至这部剧还引发了大量关于爱情和女性价值的讨论，对本来很肤浅表面的立意略有提升。杨紫没有让我失望。表演自然无痕，在搞笑和搞哭方面太有天赋了！三位男主也个个出彩。每一位都有可爱可恨可怜可气之处，是编剧把女性对男性的所有幻想期冀的浓缩。必须要提的是这部剧颜值严重超标，演技也都在线，故而想不爱上任何一人全身而退可不容易呢。
9,灵溪,5,2023/8/29 13:13,北京,193,整个夏天日日追剧的沉溺的感受遥远得像是上一辈子，虽然是四男一女，古早偶像剧的配置，但演出了正剧的深度，人总觉得一切感情不过是某种爱情的变体，其实人的复杂程度超乎人的想象，把各种感情都矮化为爱情不过是偷懒和浅薄罢了。道尽人的复杂是一切文艺作品的使命，我想长相思似乎摸对了门，而且女主身上让我看到了慈悲的力量，纵然获得这种力量首先要经历非人的痛苦，但也应该获得最纯粹的感情。
9,Domy,3,2023/10/7 21:09,四川,5,左右横跳啊。
9,不知秋,4,2024/1/11 20:48,广东,4,邓为好帅啊！！！！
9,momo,5,2024/2/25 20:36,黑龙江,3,目前清水镇部分是我最爱的part玟小六相柳玱玹丰隆都不错阿念蓐收也很好之后回归大王姬部分也就是防风邶那一part喜欢看一些等第二季上线中
9,楽无,3,2024/5/1 21:39,河北,0,奶头乐
9,叶心,4,2023/8/18 13:08,四川,390,看过小说后再来看剧，对于选角和剧情都很满意，尤其是对相柳，看小说就觉得其实真正意难平和长相思的人是小夭对相柳，其实开始我也不理解夭柳的感情，后来慢慢明白，是因为他们有相似的成长经历，而相柳又深知二人立场不同，注定只会如同小夭父母一样没有结果，所以宁愿默默守护，并时不时展现自己残忍的一面，就是为了时不时推开对方。看完对相柳多了许多的心疼
9,树上,4,2023/8/4 19:53,安徽,0,更新：半年后开始倍速补剩下的剧情，演得很好啊，把桐华最擅长写的情意演绎到位了，人设剧情还原原著很难得，这年头不魔改已是烧高香，镜双城你欠我的拿什么还！———以前对曾许诺比较喜爱但没看完长相思。只看了两集就不打分了。就第一集的回忆部分而言，很尊重曾许诺，也选用了我最有印象的昌意葬礼高潮剧情。对嫘祖和阿珩的演员没有意见，但是感觉过于温柔。昌仆演得很好，倒进墓里让人想哭。昌意虽然没出现，也改了名字，但是想到他就心痛，还有青阳……葬礼场面与我记忆中想象场景不一样，太小了，也弱化了紧张感和冲击性，但小朋友和演员不错。配乐尤其是颛顼长大后思念小夭的bgm很好听。缺点就是节奏太慢了，一直在渲染气氛，有时候可以在一个镜头里呈现的信息分成了好几个镜头，老感觉差口气。
9,momo,2,2024/1/18 12:52,广东,8,比同类片好一点，如果它们都有一星，那么这部有一点点演技和一点点逻辑的该有两星。虽然都是老桥段经典虐恋
9,luckyjinx,5,2024/4/23 11:38,北京,4,上头。但是！忍不住看了书的结局，感觉不敢看第二季了，生活已经够苦了，编剧能不能放过观众，求求别写死，都长长嘴吧?最钟意相柳，第二是哥哥（因为哥哥女人实在太多），邓为也很仙，单纯觉得角色差了点男友力。就算不和女主在一起，真的希望三个都能有好结局，见不得任何一个伤心啊?
9,斋生,5,2023/7/24 19:44,新疆,6488,小说成精！感谢紫姐！感谢剧组！
9,MissMo,4,2024/1/26 13:59,上海,4,这部剧更多的是遗憾带来的可惜，所以4星鼓励。遗憾邓为呈现的形象气质都很贴涂山璟，不富裕的演技却让官配线以及其他线（主要是夭玹）都有不同程度的崩塌；遗憾剧本（原著小说）先天不足，浪费了紫檀晚的演技，甚至是演技拯救了部分剧情的不自洽；遗憾导演的镜头和剪辑能力实在是欠缺，很多花絮里看着很不错的表演，被后期整得不伦不类，导演对演员的调教和剧本解读也很一般（我觉得涂山璟演偏了，跟导演现场说戏跑偏很有关系。本身演员演技就不足，你还不好好调教。只注重撒糖忽略人物身份逻辑，太小家子气）。更别提特效，如果是《步步》的导演+《香蜜》的特效，效果会更好一些。不敢太期待第二季，但还是可惜演员和大制作了。
9,Iris Cedar,4,2023/8/16 0:49,河南,0,第一季还不错，邓为就是涂山璟小狐狸，感谢杨紫张晚意把复杂的小夭和哥哥演的有血有肉，也更理解他们了。其他就算了。
9,风雷,3,2024/3/24 20:29,北京,0,画面没的说，演员们基本都演技在线。就是这以女主为首的稀碎的行为逻辑是咋个回事……一看作者哦……再一看小说年份……哦…………
9,lanay茶茶,4,2023/7/30 20:46,天津,1682,看杨紫演的戏总是能让人共情邓为害羞的样子好可爱
9,小玄,3,2023/8/29 16:04,广东,33,看过鹤唳华亭，玱玹的声音跟萧定权的好像啊，已经被这个嗓音迷倒了
9,HANASOSO,2,2023/9/29 20:51,四川,14,2023.9.25-9.28
10,tempremental,3,2024/4/30 13:46,加拿大,1,看了11集了，女主还是个男的?但是变回女的之后的夭璟官配很好磕，涂山璟太会了一直疯狂情话输出…骨科嗑不到一点，苍玄前期对女主真的一塌糊涂啊。夭柳在船上那段有嗑到，不过感觉就是止于暧昧了，两人都不想向前跨一步
10,小呀嘛小匆匆,4,2024/1/5 7:42,英国,7,看了3次终于在第三次的时候看进去了看进去以后就停不下来了||男主们没一个好东西||颜值每个都在线养眼所以电视节目确实是需要这些俊男美女啊
10,小蕾,3,2024/2/3 9:24,泰国,1,不知道为什么豆瓣评分那么高我觉得就是一个女人和四个男人的故事而且爱的都稍有些奇怪表哥的爱在古代是可以结婚的在剧里后面演绎的就是不能成婚璟那么聪明还不能和小夭联手斗掉防风意映？再说小夭是王姬他家应该巴不得要和皇家联姻至于那个相柳采用吸血恐吓的那种交流方式我真是接受不了不管他多么付出生命心头血之类的救小夭总之有点别扭的情感戏但里面的情感纠葛和兄妹怎么互相帮助救赎倒是挺说的过去的
10,我改名字了,5,2023/8/22 12:51,北京,467,其实快进了很多，有些台词也很尴尬，但我真的好喜欢好喜欢涂山璟啊！！！！好久没有这么喜欢一个角色了呜呜呜，小狐狸，小茶狐，小乖乖，我可太爱了！！就冲涂山璟这个角色也得给五星
10,fairyta,5,2023/12/12 15:03,俄罗斯,27,谁爱谁其实很明显。如果你很用力很克制都还是害怕一个人会人梦，只能说你的心早已为他所动了。依靠给予安全感的人也是一种喜欢。但是那是经过大脑的理智选择，不是下意识的情不自禁。小夭爱相柳，对十七只是喜欢。小夭不想毁诺，因为自己在玉山苦苦等待哥哥去接自己。哥哥没有遵守诺言，她很伤心。她只是不想十七变成另一个自己。因爱生怖。害怕相柳。因为爱。小夭给了叶十七信任。欢欢喜喜去，却没想到遭到背叛。小夭是知道不要抱期待，只靠自己的。所以信任很难。叶十七的背叛给了她重重一击。她认定是自己看人不准，开始怀疑自己了。再次遇见，心里很难受，却不是爱的留恋，而是自我怀疑自我反思，反思自己怎么会那么迟钝。接吻都能从小白兔变成大灰狼，又怎么不会从楚楚可怜变成致命一击
10,清凉油豪情万丈,4,2023/8/27 12:44,澳大利亚,377,看这部剧最大的收获—认识了檀健次(●ˇ?ˇ●)相柳演得真好
10,小眼睛爱笑眯眯,4,2023/10/1 16:37,浙江,16,没看到过书，第一季看完还没怎么搞清楚什么王什么氏的?剧情好丰富，男主有三个，都好爱女主。一开始最爱温柔善良的小狐狸，不过这退了三十多集还没退掉的婚约真是让人无语。反观九头蛇，爱得好隐忍，虽然觉得跟女主立场不同，一直没敢向女主表白，但是却舍命相救，护其一生周全。而哥哥是随时都在守护妹妹，随时在吃醋，但是又为了自己的称帝大业，不得不把妹妹的幸福当成政治的牺牲品。
10,重返61号公路,4,2024/2/13 14:28,贵州,4,我选赤水丰隆。
10,方青,2,2024/4/4 2:54,上海,5,确实比其他古偶多出一颗星，并不是硬件有多牛逼，而是几位主演演技尚可。杨紫确实是古偶演技天花板，毕竟正剧出来的，加上同行都在瞪眼嘟嘴狂叠滤镜。张晚意檀健次次之，邓为确实被对比拉了。我瞅着这剧也别拼大女主赛道了，直接整个现实主义择婿教学，里边仨男的典型的一塌糊涂，一个不聪明的狐狸，一条有生殖隔离的蛇，一个是不做人的人。女主角的人设明明挺有看头的，既具备嘲讽能力又能完成从男性到女性的转换，可惜也浪费的差不多了，后期变成传统型女主角后人物魅力直线下降，变得絮絮叨叨乏善可陈。现在回想一下，感觉确实没什么带劲的古偶啊，琅琊榜是权谋，知否算宅斗，古偶到底逃脱不了偶像剧的原罪了
10,橘次郎的夏天,4,2023/7/25 16:49,北京,2014,剧组审美在线的，三个男主气质一眼就能辨认出来。
10,十一块小饼干,2,2024/3/23 22:42,广东,4,这三个男的都不行啊一个优柔寡断只会一张嘴说一个闷头付出不会沟通情绪不稳定一个骨科要搞事业还得搞其他女的来者不拒。杨紫演技在小花中很好，但是长得还是太科技不自然，不适合演玛丽苏，求求不要再演仙女了。
10,宇宙火机,3,2024/2/4 0:58,四川,0,这剧情像被夺了舍，怀疑中段之后有灵魂主创提前拿到尾款连夜打包跑路
