page,name,rate,time,IP,favor,comment
10,chole蛮,3,2023/8/16 22:25,北京,0,7导演韩式静态审美，分镜、机位、打光都有不足，大场景调度差，撮而小国的审美没法承接国产剧的恢弘叙事。实景很难找吗？部分特效土且五毛，多处段落设计一般，后期壕但审美不足缺少想象力。扣分。演员抬剧，同期声台词功底俱佳，清水镇建新如旧烟火气浓！苍玄爱江山做寡人，夭玹家国大事权谋，但演纨绔总像是要舍身取义；璟绿茶嘴炮大师，夭璟囿于小情小爱红袖添香抚琴饮啄，璟接不住戏张力不足，不像是曾惊才绝艳的青丘公子，丰隆肖之都不像有国家大事的智慧；相柳立绘饱满敏感孤僻隐忍克制，温柔是携夭遨游海阔天空市井风情制最毒的药教最精妙的箭术，相同的性格底色，对世人世事有相同的悲悯与洞悉，对手戏张力十足。可他终究是相柳不是邶，不愿用情义束缚夭，然背负一切之人如何一争岁月静好，可惜可叹。夭的对照组，第一选择亦不是夭
10,离我远一点儿,5,2023/12/11 13:38,北京,37,扛夭柳大旗等着第二季！注定BE但就是爱邶比???
10,伊依然然,3,2023/12/13 16:23,陕西,32,除了和相柳的戏份比较好看其他的基本都是快进看完的看完最后一集发现结束的很突兀没想到还有第二季怪不得了
10,七月,3,2024/2/15 2:29,江苏,0,三星半
10,文ちゃん,4,2024/2/11 11:47,山西,3,不以爱的名义利用小夭坚定地站在小夭身后怕也只有涂山璟了
10,kinkin,5,2024/1/31 22:23,山东,20,为相柳疯狂打call，爱而不得最戳我，明明小夭也对他动心可是就是不能在一起，太让人心碎了。甘愿种下情蛊，说着最毒的话，却做着最柔软的事，相柳终成我的意难平。涂山璟一直在卖可怜，这个演员也没长在我的审美点上，有点像肖战，另外他背后的一大堆烂摊子，什么奶奶，未婚妻，哥哥，看到就心烦；玱玹则是太充满算计的一张脸，总有点心狠手辣的感觉，还多次利用小夭，加上张晚意说话有点用力过猛的感觉，演的痕迹有点重。还是抵不住檀健次的桃花眼，他明明在笑，心里却在哭?，一直陪小夭，救她，惺惺相惜，多希望他们能无拘无束浪迹天涯。最后，小猴紫仍然非常可爱，总是莫名就被她感染，眼泪也不受控制流下来了。第二季啥时候播，提前剧透了不满意啊！相柳别死啊！
10,爱学习的锦鲤,3,2023/12/30 22:28,山东,2,杨紫，始终这种感觉
10,吴白五,3,2023/10/13 12:58,吉林,50,能理解为啥女主选择涂山璟，但就是不喜欢这类男主。
11,momo,4,2023/10/11 0:15,重庆,19,整体对原著的呈现不错的，有加分。张晚意的玱玹和邓为的璟都是惊喜，本来是两个原著中不太讨好的角色，反而成了亮点。
11,呦呦鹿鸣,3,2023/10/12 9:06,江西,26,没意思，拧巴
11,洒春茶,4,2023/8/27 15:35,瑞典,97,各位主演的演技实在没话说的紫的演技让我想去看一下香蜜如何
11,二郎腿毛,3,2023/8/22 11:34,浙江,66,又是前面精彩后面疲软
11,超人,5,2024/3/18 12:17,海南,0,这么高密度的抒情简直已经有了吸毒质感。但是不得不说，能把这么高密度的抒情控制得这么细腻丰富，还是让人很佩服的。明明可以过把瘾就死的一次看完，因为这个莫名其妙的新规必须卡在中间，跟躺在ICU一样难受，服了。
11,晒兜/shadow,3,2023/10/4 0:44,浙江,46,相柳设定太绝了。演员也抓住了机会。
11,Mungdei,5,2023/8/12 21:33,湖北,1157,夭玹be是宿命，he不了一点，以后玱玹只能像他爷爷一样一个人吃年夜饭。一个人长相思了。二搭吧，就当夭玹下辈子在一起了。想了很久还是给了五星，缺点真的很多，导演配乐真的不够格，腾讯你是不是在捧新人导演啊？但是这是杨紫和张晚意的哥妹啊！以后有没有二搭很难说QAQ杨紫二搭的男演员好少，所以我只能珍惜还有什么办法？？？?腾讯组个民国本子给他们搭啊！！！
11,秋,4,2024/4/1 20:40,江苏,4,之前觉得就是是可以而已。毕竟紫妹就是稳定发挥而已。但是从与凤行过来，觉得这部一对比可就太好看了。
11,insanity ver.,3,2024/2/22 13:20,浙江,3,艰难看完……某狐没演技演贝，太拉垮，后段和女主对手戏全程拉进度条，真的要疯
11,SASO,4,2023/12/14 3:34,北京,17,俩科班主演原声太加分了
11,仙儿,4,2023/10/16 1:18,北京,7,很成熟的古偶制作，爆款不是没有理由的～
11,吐槽狂人叔本华,1,2023/10/18 0:10,广东,454,真心希望女性自尊自爱自信自强，而不是妄图通过被男性爱上，并自毁来获得被爱的精神胜利。
11,武东飞啊…,2,2024/3/12 19:28,北京,6,我看了个啥？古偶越来越为了虐了虐……
11,稻垛,3,2024/4/9 13:23,北京,0,很喜欢蚊小六部分，后面有些无聊
11,叮咚～,5,2024/4/7 10:45,河北,7,为檀健次的演技高分！
11,折璃,3,2023/10/1 9:54,广西,6,第一季差两集没看完……这个剧的宫斗水平就是没有水平，女主男身的时候好看，换回女装纠结于三个没用男人以后就不行了，对，三个男的都不行，希望女主独美……
11,沙漠的小螃蟹,4,2024/1/22 22:30,云南,5,古偶里的高配吧。四个男性角色都很帅气且各有风格，除了两个略生涩以外，另两个演技都到位。女主也很好，没有恋爱脑，比较清醒，她知道要帮助男主，也明白与男二无法走下去，干脆不抱幻想选择男三，这样情绪稳定、智商还算在线的女性在国产剧很难得。没装傻白甜，也没夹子音，我很欣赏。
11,月亮很亮很凉,2,2023/9/25 21:24,上海,51,剧情拖沓，追不下去
11,mi,4,2024/2/3 16:44,北京,4,看下去了，还带有三分真心地磕了
11,麦兜卖菠萝油,3,2024/2/15 21:58,安徽,1,我怎么去年暑假看完没标记？杨紫的小夭就是最合适的，演的相当到位，而且看采访她的理解也是非常准确的，她就是书里走出来的小夭。但是剧本改编和场面拍摄配不上演员演技，小夭变回大王姬以后剧情比较拖沓，没什么实质内容，小夭的性格也变得黏黏糊糊的不太讨喜，再有就是很多大场面拍的小里小气，看完感觉就这？？其实三个男主我都不是很满意，邓为的涂山璟演技不太够，檀健次的演技最好，低音炮声线迷人打戏好看，但是剧本的人设远不如书里的相柳有魅力，张晚意的表哥跟杨紫有好几个名场面，但是有时候演技有些呆呆的，就是有点木。ost一开始觉得都有点平一般般看着看着跟有些场景还蛮搭的，毛不易的《有你无你》和张杰的《万物不如你》还挺有氛围感的。还是期待第二部的搞快点吧！
12,沐赟瑶瑶瑶,3,2023/8/26 22:31,江苏,0,高开低走，女主人设问题是没有自己的行动，苍玄线能不能认真搞点权谋。--------看过桐华小说改编两部电视剧下来，发现女主都有个共性就是都没有自己明确要做的事情，乐于思考但在行动上一直处于一个被动接受的位置？不知道女主是否也反映了作者的心理。--------想看entj和intj对手互殴吗？想看entj爱而不得发疯吗？想看intj爱而不得自创吗？想看infj贴身相伴用实力诠释f强势攻心吗？想看entj嫉妒infj的温柔，intj嫉妒entj和entp的同盟，infj嫉妒entp对intj的动心，三人互相乱杀吗？想看intj、entj和infj众星捧月宠着entp吗？想看intj想从entj掌控下和infj和怀抱里带走entp却被拒绝吗？entp好日子，尽在《长相思》。
12,1.也不能的陈能,2,2024/1/26 19:51,重庆,15,受不了什么鬼要不是檀健次这部剧完全没法看
12,??,3,2023/9/8 22:36,浙江,14,清水镇的部分最好看，在几个男主间跳来跳去，第二部表哥会上大分吧，狐狸和男大也挺有意思
12,柒宝の全世界?,4,2024/2/1 23:09,湖南,14,看小说喜欢璟，讨厌哥哥，对相柳没啥感觉。看剧，喜欢璟，喜欢相柳，讨厌哥哥～不得不说谈个檀健次的相柳太贴脸了～下半部快点播呀～
12,Bibibibibi,2,2024/3/2 19:28,江苏,5,节奏太拖沓，五毛特效
12,拂晓醉晨光,4,2023/7/24 21:33,北京,1823,这剧最神奇的是几个男主的线捋的都很清楚，每段关系都有非常合理的开始、发现，而且出来一个我磕一个完全不受影响，比我预想的好太多了！
12,伍贰零叁舍长,3,2024/2/29 17:04,广东,3,主角团除了某人都有演技，让我硬是看完了这无语的剧情……
12,奥利奥奶茶,4,2023/8/24 11:30,加拿大,137,好看?第二季什么时候来？杨紫终于把原本的好演技发挥出来了，选剧本选角色真的很重要！张晚意把一个杀伐决断、深情又隐忍的上位者刻画得很动人，这人设换个人演可能会演砸，其他男主人设挺好演得中规中矩吧，期待第二季
12,蛰伏的文子,3,2024/3/3 9:12,上海,3,比较喜欢清水镇的部分，身份回归之后剧情就非常无聊了，只跳着看了小夭和相柳的互动，似乎这样的爱情或者这样的人设有点趣…整体应该也就两星，剧本的锅
12,缘雪,3,2023/10/4 6:57,上海,22,没看过原著。就这仨人设来说，未免落了俗套，把剧情往裹脚布方向带了。相柳本是人设最好的，但后续情感太外露了；璟没了自我，本是痴情表现，但又好像智商欠费；玱玹就是标准爱而不得，从来都不是良配，却又不甘只做哥哥。只能说，打发时间勉强可看吧，但真的剧情太拖了。
12,小砂,3,2023/12/31 19:59,爱尔兰,0,一直羞于标记的一部剧，在朋友家吃饭打了一天麻将看的，神奇的是我们到他们家从十几集开始看起还双倍速度竟然完全不影响剧情理解。长相思的小说（我还看过，好羞耻）本来就足够玛丽苏了配上前司工业糖精的加工，台词能憋到内伤，确实非常影响打麻将体验。不夸张说我朋友老公因为刚好正对电视剧，那天麻将一输三。但是神奇的是比对目前国产偶像剧的水平，这部能看下去就算成功了，目前国产甜宠剧标准真的是二倍速能下饭就还行了。
12,DZeer,4,2024/2/15 16:53,上海,13,不磕夭柳了：）小夭不值得，看着看着再来补一句，我的相柳一定是个T人，明知道没结果的事就连一毛钱希望也不给得了
12,四季花纷落如雨,4,2024/3/9 22:47,北京,6,为相柳来看的！相柳满分！
12,玛吉,5,2023/8/18 9:44,浙江,453,夭柳党
12,jenstylinson,4,2023/7/24 21:21,澳大利亚,3017,审判了四级比香蜜好看是可以说的吗
12,baby愛,4,2024/1/8 13:51,陕西,7,不俗套的剧情，很正的价值观，精湛的演技，温馨的结局，这就够了。
12,momo,2,2024/4/17 14:02,澳大利亚,6,节奏真拖沓两倍速看都嫌慢各种意义不明的凝视和停顿和mv式的画面人物背景全靠嘴交代政治斗争也跟过家家似的（写不出来还硬写）女主角嘴上一直叨叨不要先付出不要为了男人这那的然后一直在为三个男人付出她自己到底为了自己干过啥而且都做神仙了居然还在男尊女卑靠血缘靠姻亲靠裙带关系我也是醉了。。。三个男主两个演技还行另一个像块木头。。就相柳的剧情有点意思能1.5倍速看下去看懂了这是个女主开后宫1v3的玛丽苏故事之后就合理多了反正一切为玛丽苏服务就是了可是作为偶像剧里面一个长得好看的人都没有属于偶像剧失格。。。这剧6分不能更多了。。。古偶现在也消费降级了吗
12,安心,4,2024/1/5 22:27,黑龙江,7,7.8/4?这部剧最大的问题是玱玹这个男主略显平庸，剧中浓墨重彩的渲染他对小夭的执着守护，他的政治头脑和对权利的欲望都没有很好的表现，最后给人的感觉就是政治主张恰好与西炎王一致就把王位传他了。相柳直到最后都没有直面对小夭的爱，是从小经历导致他性格使然，我对他始终心疼不起来，真爱她就别咬她！涂山璟虽然有些窝囊，但确是个性塑造最真实的一个。而我真正喜闻乐见的是小夭最后能跟丰隆在一起。
12,湖心婷看雪,5,2024/3/29 23:07,北京,2,高度还原，小狐狸怎么可以这么好看，委屈巴巴
12,羊哩哩,4,2023/10/6 7:53,湖南,22,把官配拍成懦弱的工具人了
13,伯德兰,5,2024/4/30 8:51,云南,2,剧本是真的过硬，演员是真的无可挑剔，构图是真的美，从服道化来看，剧组也是真的有钱。
13,爱吃橙子的妮子,1,2023/9/1 2:47,贵州,2,杨紫的脸越来越僵
13,w西肆,3,2024/1/6 17:41,湖南,1,这是39集长预告吗？
13,太阳糕,5,2023/9/29 4:01,美国,25,骨科真好嗑
13,小嗷,4,2023/8/25 13:39,浙江,421,后面演变为看相柳cut这两天一天到晚看相柳，然后流眼泪。为相柳升星???????三星观望。目前除了第一集，观感不错。檀健次就适合这类装装的角色，比猎罪图鉴里装得好，很自然哈哈哈，一点儿也不油腻。杨紫和邓为痕迹还是有点重。
13,momo,3,2023/12/30 23:06,上海,10,相柳是最dio哒
13,A-ya,4,2023/9/30 20:50,江苏,19,叶十七真是最大的惊喜
13,猫猫不吃小鱼干,4,2024/3/29 18:48,陕西,1,挺好，四位男主都很喜欢。
13,山有木兮木有枝,4,2024/2/10 11:00,辽宁,0,如果当时没有莲花楼横空出世，或许这部剧真的能成为特别吸引我的存在吧
13,是°你de大胯,4,2024/1/13 20:43,辽宁,11,看两个帅哥打架真是赏心悦目啊谁规定的男主一定要喜欢女主，正经兄妹不行吗真是没有困难制造困难也不让女主和男二在一起啊(邓为古装很帅啊)至于相柳这人设就是爱而不得的命啊，默默付出伤身又伤心(檀健次演的很好)
13,mouetteO,4,2023/12/12 22:40,北京,11,你和我有过那种东西：本能的、抓不住的、奋不顾身的、背离对人生所有期望的、赤裸存在却无法命名的。我会选择和另一个人在一起，而你会宿命般早早死掉，这是两个不纯粹的人配得上的唯一结局。我会将你忘记，长相思在长相守面前显得那么虚幻可笑。在我最想要的和平里，在我变老的那一年，被我的梦拒之门外的你终会重回我的梦里。
13,芝士猫,5,2024/1/19 9:55,上海,9,永远磕夭璟
13,Sang Chow,5,2023/9/26 23:18,广东,68,赐我一个涂山璟。
13,小小巫,4,2024/4/26 18:15,北京,3,很牛逼
13,陈江菀,3,2023/8/4 0:26,江西,0,邓为演技还不够，又是什么婚约限制感情发展，这剧要是40集演完，绝对更精彩
13,松露果冻,5,2023/8/31 12:35,上海,59,什么时候播第二部！好久没找到喜欢到要去再看一遍小说的程度的电视剧了。狐狸和蛇宝宝都喜欢！
13,失物招领,4,2023/8/13 19:36,广东,779,夭玹我们磕的是爱情吗不是我们磕的是互相扶持磕的是休戚与共磕的是青梅竹马磕的是生死相依磕的是永远的顺位第一磕的是极致be磕的是清醒着沉沦
13,juliana,5,2024/2/13 9:03,上海,4,非原著党，杨紫演技不错，琢磨细节也用心。男一二三四也都不错，看此类剧，要有看剧的觉悟，莫与原著对比，莫考虑家国大义，美否？用力过猛否？甜否？酸否？能让你熬夜想看否？还是忍不住看了原著，感觉剧拍得更立体些。几个主角演技不错，细节，眼神把握到位，经得起细品。期待第二季。
13,懒癌患者,5,2024/2/13 2:04,浙江,18,不是十七不好，是相柳太好了?????
13,未来的春天,5,2023/7/24 19:07,福建,6147,神医玟小六真的很灵动可爱，“久婚不孕我包治，药到病除送子来”这句能成为该剧经典台词天花板。
14,月野达也,4,2024/1/23 5:19,北京,3,还是很还原小说的
14,まるこ?,未知,2023/9/29 8:14,广东,38,中途磕不下去官配了一路奔着柳去了，然后被发展成了檀健次的下线……
14,纳米光年,5,2023/8/6 16:36,浙江,2236,檀健次好帅啊
14,小星星,3,2024/4/16 21:54,广东,8,大女主剧，结果女主一直在被推着走。
14,Medea_Medusa,4,2023/8/27 11:04,江苏,41,只是淑芬，不抱任何期待进来，但却完全超出预期……果然只要认真照原著拍，就真的很可以，应该是原作者介入的力量……不得不承认，杨紫虽然外形不优秀，但有她自己的优势，就是她肯放下女明星的架子大开大合地演一个流里流气油嘴滑舌的男人，还演起来得心应手，也算本色出演了哈，基本上和角色融为一体。相柳和璟都不错，玱玹有点拉胯。豆瓣评分跟我心理7.5评分基本一致。
14,橙子,3,2023/9/26 9:21,福建,8,绿幕剧，看的那叫一个难受。还是年轻人喜欢的剧，老人家硬撑着看完。
14,云淡风轻鸢飞扬,5,2023/8/15 20:42,上海,1,原著小说我看了三四遍，第一遍被相柳感动，第二遍看到了玱玹的爱而不得和隐忍，第三遍明白了为什么小夭选择了文中笔墨似乎不多但却似乎无处不在的涂山璟，第四遍则是理解所有人的选择和命运。作为原著党，本来是以乐子人心态去审判，却意外发现了邓为涂山璟。看剧前都不认识邓为，还担心他演不好这么白月光的角色，片花看着眉眼清秀，眼睛亮晶晶还挺像小狐狸的，开播后一下子被惊艳到，他是活生生的纸片人涂山璟，却也突破了我的想象（娇、美、忠犬、眼睛会爱人、破碎感、温和又坚定…），我想象不到还会有谁能饰演出这么多重魅力的涂山璟。戏外的他也温柔谦逊、彬彬有礼，跟涂山璟的人生轨迹有重合，对人物的理解精准且言之有物，让人共情～呜呜呜，赚了我好多眼泪。很看好邓为，出道不到三年的新人，能够做到尊重理解角色，尽可能还原纸片人，未来可期
14,过春天,3,2023/9/3 12:05,北京,27,前面比后面好看很多，后面剧情实在太磨叽了，女主人设也多少有点崩
14,山中人兮芳杜若_,5,2024/1/23 22:09,辽宁,7,4.5/5剧情紧凑饱满，妆造布景精致有美感，全员演技在线，各个角色选角很成功，难得所有的演员都合乎眼缘。中途忍不住看了一点点桐华的原著小说，剧版的台词几乎完美还原。几个男配的感情都刻画的细致入微，特别好，期待第二季！
14,淞樰,2,2024/1/16 0:35,湖北,27,又不是美女还总演绝色的神女仙女，尴尬！演员应有的演技也只有粉丝一直吹的天上有地上无的。
14,MORE,5,2023/8/11 0:29,广东,13,五星致敬檀健次
14,金鱼,4,2023/10/2 0:47,上海,13,突然懂了玱玹的心思和小夭的狠我愿成为帝王的妹妹，有丰隆这样的朋友，有着相柳的男友，娶回璟这样的人
14,exit2000,3,2023/8/3 23:32,日本,0,大家各自找回身份后的服道好拉垮啊，怎么变回了神仙反而还不如人了，感觉都演得挺用力的。（檀健次凭演技给自己做了医美
14,无名,4,2024/1/23 12:24,浙江,21,四星全给相柳
14,艺术家一礼拜了,5,2023/8/28 15:55,北京,39,整个过程就很莫名其妙……先嗑夭璟，又入坑夭柳，最后爱上了玱玹，成了张晚意唯粉！现在追张晚意一切作品，他演戏为什么这么让人喜欢？？
14,^^,4,2023/8/4 17:16,河南,823,目前没得挑…非常好
14,Si,5,2023/8/17 9:47,湖南,507,杨紫就是质量的保证??
14,一凡一凡,4,2024/2/28 12:20,北京,3,相柳！
14,金小酒要快乐,4,2024/3/10 0:53,广东,2,本来看到太多营销不想看，后面看了剪辑觉得不错，就追了，结果一看就上头，不过第一季这个结局戛然而止是认真的吗？最喜欢夭柳，相柳的爱是自愿引情蛊上身，是心尖血，是触碰又收回的手，是陪你赏月也陪你入海，也是被小夭突然拥抱时还未隐藏脸上的惊愕和爱意
14,软软,2,2024/2/1 14:26,江西,5,好狗血
15,isaasi,3,2023/12/11 20:45,荷兰,3,这里边的心理构架反射出的是大部分女性强烈的不安全感吧，如果这个作品卖得好，只能说明普遍的年轻女孩子对感情认知很不健康，又或者说，这种价值观的传递和接受会导致不健康的两性关系
15,经冬复历春,3,2023/8/25 12:39,湖南,42,看之前：大女主与四个舔狗的故事。看之后：相柳帅气有演技，涂山璟做我的忠犬小狗吧。
15,丸,5,2024/3/28 2:09,上海,5,紫妹都可以一拖三了檀健次的坚持不容易张晚意太惊喜了邓为就很茶
15,Bornwind,3,2023/10/3 10:26,北京,21,1坚定不移地奉行夭柳原则，2杨紫张晚意檀健次绝了，3有什么必要拍40集嘛！！拖拖沓沓
15,pricessbridget,2,2023/10/4 9:00,湖北,24,假期看剧。总结来说就是消磨时间的下饭偶像剧。配乐、布景、演员都一副煞有介事的模样，但是剧情、角色设定、人物关系都不可避免的俗气、陈旧而乏味可陈。杨紫、檀健次演技可以的。
15,肥玉仔,5,2024/1/2 22:49,天津,7,紫妹真的是90花的优秀代表佳作频出青簪行一定也是很好的剧可恶的吴某三个男主虽然都是小夭生命中非常有份量的存在，但是玱玹是亲情，相柳是有过心动的相知玩伴，只有璟是想要相守的归宿啊。
15,Ginkgo,4,2024/4/20 16:13,湖北,1,兄妹情、爱情、蓝颜知己，还有罕见的特别拎的清的女主，有文化内涵的原著/编剧，剧情不低幼，全员颜值在线，拉高古偶水平；涂山璟的角色太弱了，像男宠；恋爱戏我确实甜到了；丰隆的角色包括演员都贴合30集后的节奏慢了。期待第二部。
15,安吉,5,2023/7/24 19:41,山东,4300,终于有个能看下去的仙侠剧了，谁懂啊！！
15,女文青张大民,3,2023/9/26 10:11,上海,2,甜妹真的甜
15,木紫,4,2023/8/27 12:23,北京,22,画面唯美，男主们各有魅力也各有缺点，故事背景好，挺伤的
15,淡淡的兔子,3,2023/7/30 9:23,上海,143,剧情不错
15,ぺ 紊乱,5,2023/8/6 16:45,江苏,1809,哥哥一统天下，老公战死沙场，我和我的狗安度余生。
15,雨中笠,4,2023/7/24 20:15,陕西,2019,赢在了脸上这里边男的一个比一个帅被张晚意帅晕
15,snowden,4,2023/8/16 23:55,美国,38,最近难得可以从头看到底的剧。期待第二部
15,非非,4,2024/1/8 2:12,江苏,12,相柳这个角色真的是完成度非常高。以及，这部起码几个主演都是演技在线的
15,糖糖糖糖,5,2024/2/15 19:15,广东,35,除了邓为的演技时不时掉线，其他的三位主演都把纸片人演活了
15,another_world,4,2024/4/27 13:34,上海,1,可能年纪大了，蛮喜欢叶十七的
15,龙龙卷,5,2024/3/25 15:29,安徽,2,太强了，杨紫
15,桃仁活血,3,2023/10/1 23:30,浙江,6,第三十六集！桐华你是江郎才尽，没有别的梗可以写了吗？？？？这都2023年了，你还整这死出，这种烂梗也能突然给我出现…………拳头硬了没人吐槽第三十六集吗？？？
15,天恢雪,5,2023/8/2 23:13,澳大利亚,776,好看，帅哥养眼，剧情揪心。节奏还行。
16,毛颖,5,2023/9/24 15:59,北京,20,还不错?
16,被夹的蕾封葛格,3,2023/9/30 17:26,北京,4,各种虐，一直虐，导演有瘾？
16,橡皮鸟,1,2024/2/25 7:42,广东,6,在姐姐家看了几集，这啥玩意，还有杨紫别演了，这演得比六年前的香蜜还差
16,骑猪_追奔驰、,1,2024/1/2 16:43,湖南,82,被安利来的浪费时间果然好剧要看缘分越到后来越乱七八糟一地鸡毛慢的死还毫无逻辑性没任何欲望追下去离开清水镇越来越磨叽7.8分有多水无效段落一大把没有颠荡起伏的推进剧情台词也水宁安如梦论台词剧情梗都比这货好太多都是6.8分豆瓣现在也这么水了天璟感情线也单薄又单一女主又撩又立渣女人设一星都嫌多24集弃不敢想象还有勇气追加拍第二季第三集OMG
16,亲爱的雷拉,3,2023/9/14 22:18,云南,0,就只有相柳吸引人一点
16,MOMO,4,2024/2/3 16:18,河南,4,制作精良，很好看，为子确实还是有几分姿色的，我承认以前对你声音大了点。
16,碎碎念大王,5,2023/8/22 11:33,四川,119,上周四追完的，然后沉迷至今，可想这个剧带给观众的力度
16,琥珀,3,2023/8/8 16:56,湖北,201,20221103相柳看上去不错，到时候可以瞅瞅cut。20230808出来当天就看完了更新的那几集，因为太好奇就看完了长相思这本小说，前面写得很不错，由桑甜引发出的那段话也很好，三个男主也看得出是精心塑造的，算三种经典款吧，对应感情纠葛也写得比较极致，但是，女主她做成了个啥呢？她开头说的无力自保无人相依无处可去，结果居然是相柳成全的，还成了个相柳爱情的闪光点？那这女主呢？她主动为避免这三件事做了什么呢？看完小说，就没兴趣继续看电视剧了。
