page,name,rate,time,IP,favor,comment
22,Leave,4,2023/10/5 10:03,北京,35,爱的不同方式，在几个男人里面展现了如此大的差异化。相柳着实美强惨，深爱又隐忍，太心疼了。
22,念一露,3,2024/1/11 15:05,四川,0,两个男配深得我心
22,豆友533178414,3,2024/5/3 2:27,江苏,0,大场面很拉胯但是对手戏不错演员演技不错檀健次有好几个镜头演的很好但是那个挖心头血给我笑死了哈哈哈哈哈我
22,BisI,4,2024/2/18 6:05,广东,0,官配党yyds其实这编剧挺会的就一开始我接受不了的她慢慢铺垫剧情然后慢慢地我就可以接受了我看之前我不知道女主最后会和谁在一起谁是官配然后刚开始狐狸我觉得太弱了接受不了后来他的忠心我觉得可以了相柳刚开始真的太凶了家暴男后来从他要中蛊开始真有点心疼他了苍玄一开始设定是哥哥我就真的当兄妹情只能是哥哥后来哥哥一步步疯批的操作我又觉得可以了看剧时我以为官配会是哥哥因为他是男主一般不都和男主在一起的嘛然后我看有的剧情就像给男女主铺垫感情比如明明是去见狐狸回来却和哥哥说为了给他带傀儡还有去见狐狸是为了哥哥因为哥哥需要狐狸的帮助还好官配不是哥哥我看到后面他俩分手我以为会是哥哥我都要弃剧了还好后来刷字母站说官配是狐狸官配yyds
22,想飞的米米,4,2023/8/16 23:36,江西,21,分两季！调胃口！一季结束时竟然是丰隆，正如紫霞仙子说猜对了过程但没中结局，婚退了一季都没退成，瑾太柔弱了！还认为他是个狐狸来个反转狠角也成呢！剧内人物想法都太通透了（无谓情爱、只为自己想要、理性），都是神的思维模式吧！get到相柳还是他作为防风邶骑马黑衣高空射箭时，心目中的九头蛇应该更高大一些，担心选角盖过前两位男主吗？导演已经厚待了，每次相柳出场都附带音乐呢
22,沁时,5,2023/10/6 17:52,北京,51,我爱涂山璟！！！
22,尉迟 漠,未知,2024/2/18 5:00,浙江,0,看完了但是当成背景音看的感觉需要二刷
22,青时,5,2023/8/24 13:05,四川,143,我趣啊啊啊啊啊啊啊啊啊啊啊啊啊啊檀健次太帅了啊啊狠狠get到檀健次的颜了，天选相柳！！！
22,Joa,5,2023/9/9 22:16,上海,57,磕疯了！檀健次杀疯了！张晚意后期邓为前期也很绝！叶十七是人间理想，相柳是人间妄想，表哥是深渊中的陪伴和相守，是生命中最重要的人。
22,Ivanka,3,2024/2/17 19:23,北京,0,一个女主海了四五个，看了快30集还没搞清哪个是男主。
23,陳以叁,3,2023/8/22 13:48,四川,46,不管，我就是偏爱狐狸。
23,睿雨,3,2023/10/22 22:16,湖北,13,果然是十年前流行的言情…这摇摆不定，看着真蛋疼啊
23,shenqingiris,4,2023/12/31 5:17,广东,27,只嗑相柳，唯一的意难平。不知道为啥三个里面最无感的就是涂山璟
23,??*,2,2024/1/8 2:44,四川,10,21集弃。小六在成为小夭之后越来越没有了自己。她甚至没想过恢复自己强大的灵力，在一个以灵力为划分强弱标准的世界里。之后看了B站一些姐妹的分析以及大结局解说。这部剧的厌女思想太浓了。要不是各位演员演技在线甚至只想给一星。
23,胡歌我男神呀,5,2023/8/24 15:25,河南,85,好看！
23,千野良奈,4,2023/7/24 20:09,江西,1241,笑着告别，分开始才红了眼眶，小夭和小玹玱之间的情谊也蛮好哭的。
23,?,5,2023/8/16 15:07,广东,615,往哪个方向磕能遇上涂山璟这样的人。
23,gsl,3,2024/1/10 18:07,上海,1,不讨厌这剧，因为从制作上来说真的是精良，演员的表演也很好。但也没法很推崇，因为其实骨子里就是另一部《小时代》，男女主角都是衣食无忧、搞得都是天下大势，谈得都是天崩地裂，专为十几岁的恋爱脑少女准备的。当然，这样没啥不好，偶尔也调剂也需要，但看完没啥可回味的。
23,暮烟,4,2024/1/6 22:20,山东,1,比预期好，早古IP翻车的实在太多了
23,孙孙的豆瓣,5,2024/4/7 17:32,湖北,8,相柳真的好喜欢?啊啊啊啊真的好喜欢相柳！！！
23,弥补记忆丧失,5,2023/9/10 16:53,湖北,47,说实话拍摄剪辑很一般，但是演员真的好棒，而且桐华的作品真的我隔在多年还是会被感动，那种每个人命运里的无奈真的太喜欢。
23,铃兰啊铃兰,3,2023/12/17 14:26,北京,2,又是一部看完标记的。4个帅哥我爱看，难以抉择！不过女主毫无成长线也是醉了。
23,睿哥在此^O^,1,2024/1/10 9:13,广东,3,丑死了
23,wuli阿莹,5,2023/8/6 14:49,辽宁,388,好看！！
23,雪梨,4,2023/8/22 14:26,广西,69,相柳帅到我了相柳防风邶我想你
23,momo,3,2024/1/30 15:14,日本,5,3个男主最喜欢九头蛇形象最丰满，其他两个都挺俗套的，亲梅竹马妹控表哥，狐狸就没有个人人格整个贤妻良母男版。还有，没见过这么口口声声看似有主见实则非常恋爱脑的女主……跟热评一样的感觉，前面清水镇还好，后面真的乏了，好无聊，整天没事干主线就是谈恋爱闹别扭谈恋爱之间反复循环?
23,幽小可,4,2023/7/26 15:09,北京,577,除了第一集交代的有点拖沓，后边还挺好看的，女主演的很好，三个男主也各有特点，画面色调台词都很舒服，继续往后看
23,无事请旁观,4,2024/1/15 13:08,河北,12,相柳你糊涂啊?掺和这档子烂事儿干啥
23,杜皮,4,2024/2/24 21:31,江苏,7,在女主还是玟小六阶段，剧情还是不错的，后面恢复王姬身份后，除了相柳出场的片段其它都完全不想看了。
23,y,3,2023/8/15 20:27,江苏,2,相柳我给十颗星檀健次真是太棒了是我看过的古偶里演技最好的最惊艳的存在太好了妈呀太精彩了绝了眼神太有戏了相柳能遇到这么好的演员真是太幸运了只要他出场就是高光每一帧都极度舒适这年头我竟然还能看到如此仙品啊啊啊啊啊啊啊我疯了檀健次啊请多拍好剧好电影造福观众吧内?竟然还有这么一位优秀的演员我都要哭了在剧版人设被删改的情况下檀健次硬是挣扎出了相柳的风骨
24,___,3,2023/9/26 23:27,北京,20,相柳真的意难平??
24,佳嬷嬷（求职版,4,2024/3/2 1:19,湖南,1,延迟追剧好开心，可以一口气看完第一季，虽然剧本有些瑕疵但是瑕不掩瑜，演技都还不错，看的很投入。喜欢好多剧中角色。最喜欢小狐狸，理解了纣王。期待第二季。我觉得这部剧的插曲没有特别好听的，感情渲染方面差了一点挺可惜的。第二季插曲上给点力呀。
24,沉默书生,3,2023/8/22 13:07,重庆,78,感觉小夭变回身份后没有玟小六那么灵了，相柳很爱，后面主要是通过抖看剧。
24,Noni’s,3,2024/1/10 18:01,湖北,0,大病一场在家和妈妈一起看完了和涂山璟的线真的有点像家庭伦理剧好狗血?
24,十里八乡俊后生,2,2024/4/19 10:23,四川,0,不好看，女主一直在被虐待，遇见的都是渣男。
24,慕容一浪,1,2024/2/23 7:59,刚果民主共和国,8,剧情没有一点打人的
24,烟雨江湖,5,2023/7/28 10:33,,1409,现在的时代，编剧不行，演员演技不行是要凉的。观众已经厌倦了流量剧。嘉行也就没几个演技能拿的出手的，别说热巴演技好，呵呵，杨幂也算了，好好做老板就好了，杨幂公司的感觉都是颜值派，没什么演技派。私以为赵丽颖的演技是可以的，现在冒头的杨紫也不错，小花里面能想得到演技好的恕我想不出来几个。啥李易峰，杨洋这种能不能别凑热闹，最近欢瑞的任嘉伦，秦俊杰演技倒是不错，秦俊杰么颜值太弱了点。邓伦也可以啊，就是驼背了点，90后老阿姨想看部编剧OK，男女主演技OK的剧太难……为啥……有演技的青年演员数不出来……编剧没功底，有功底的还要注水赚钱……希望国产剧的春天能早点到来，近期看到香蜜，凰权，如懿传稍稍有些宽慰，但是还是靠着40岁的老演员在撑演技。青年演员能不能好好练点演技……
24,众乐不如独乐,4,2023/9/17 16:37,江苏,19,小说还原度很高，还可以
24,haytenkm,4,2023/8/19 18:34,江苏,1,“涂山家的狐狸太没用了”，七三转投夭柳、夭玹党！桐华是怎么做到把每个人物都写地这么苦、而每对CP又都好磕的！堂堂大王姬同时要三个男人怎么了？
24,鸥鹭,4,2023/9/2 14:30,广东,67,杨紫真的很难不路转粉事业粉应该不少吧这演技也太炸裂了
24,啊湫余,4,2024/1/20 4:55,加拿大,7,杨紫的颜值不足以说服我有三个男人同时爱她虽然这仨男的也不怎么样看得我难受选哪个都有点下不了手。女主为了帮相柳绑架女二也有点莫名其妙，为什么要用自己的真实身份小六去，她不怕苍玄生气把她收养的那些人给怎么样吗。她对相柳怎么就如此上心了，连后果都不顾了。她和相柳的剧情好多谈心，有点无聊。被男主打断腿也是无语，男主还能真杀了十七吗，为什么不一鼓作气的逃走呢。这样犹豫圣母的性格实在不是我的菜。男二也是懦弱无能，不晓得女主怎会会喜欢他。反而防风意映的性格还挺有趣的，演员也挺好看的。相柳很帅，银发质感很好，服饰也很仙气好看。（看到30集要爱上相柳了，至少真的献出自己帮到了女主，那个自杀的璟你一个人躺着吧，演的是啥啊，看得我尴尬）男主声音有点软，要是更低沉一点就更好了，一些生气的戏份，尾音总是很奇怪。
24,Rogan九宸,3,2023/9/26 0:09,河北,5,难评……可能因为我不喜欢看这种1V3的爱情故事……但是不得不说张晚意演技很不错，总感觉花在古偶上浪费了
24,和尚撞钟,4,2024/4/11 16:20,贵州,0,疯狂打call，第二季什么时候来？幺柳党磕生磕死_@@_
24,张大苹,3,2024/2/3 16:59,黑龙江,2,其实也就是两星，一个古偶片，颜值担当竟然是男人撑起来的。虽然我很喜欢杨紫，但不得不说这舒适圈她待的太久了，我想看她演现代大女主剧。张晚意和檀健次都很惊喜，好评一个。相柳真是太苦了，每一次的真心相待都偷偷摸摸，或者伪装成交换，嘴硬心软，自己吃苦。感觉片的很大问题其实在导演这，很多转折剧情推进都莫名其妙。
24,戒子,1,2023/9/29 9:46,山东,17,剧情真水又臭又长，台词像小学生写的
24,霑叔一声笑,4,2023/10/9 4:35,广西,11,喜欢相柳这款hhh10集以后get到了玱玹，他瞎得好好笑，这下好了，愣是嗑不下官配……体会到了以往古早男二粉的心情……一整个破防…不过我以为的刀子反倒变成了糖，就还可以，爱是克制的良好诠释??
24,摸?中,4,2024/2/27 18:23,重庆,2,确实挺还原小说的，我还是那么喜欢少昊，真是桀骜不羁的一生
24,瓜地小农,3,2024/4/11 21:20,浙江,2,杨紫和檀健次确实不错
24,岸辺露伴,3,2023/9/3 13:22,广西,155,我看长相思不是因为它好看，而是相柳在它手上。
24,1995往昔,5,2023/10/4 21:31,北京,18,爱而不得的帅气男人，总是让人心痛?
25,随风飘散,3,2023/8/26 11:41,浙江,13,这感情戏绕来绕去的头晕
25,顶流懒羊羊,3,2023/10/2 1:19,河南,2,时好时坏，演员最佳
25,竹小息,4,2023/9/6 15:27,北京,20,永远偏爱温柔的人设！！！喜欢夭璟，但我心疼夭玹，夭柳，什么都磕让我营养均衡
25,孟春之月,1,2023/7/28 13:16,安徽,2,她两耳傍肩三孔鼻未曾开言先转腚每一日蹲窝里把蛋来卧老粉嘴多半辈儿以为自己是只鸡那马户不知道他是一头驴那又鸟不知道他是一只鸡勾栏从来扮高雅自古公公好威名马户爱听那又鸟的曲三更的草鸡打鸣当司晨半扇门楣上裱真情它红描翅那个黑画皮绿绣鸡冠金镶蹄可是那从来煤蛋儿生来就黑不管你咋样洗呀那也是个脏东西那马户不知道他是一头驴那又鸟不知道他是一只鸡岂有画堂登猪狗哪来鞋拔作如意
25,CrossoverKing,4,2023/7/28 17:23,河南,715,一颗心被这剧反复拿捏，撒两口糖喂把刀子，关键是这刀子还合情合理，是早就埋下的伏笔，编剧确实有点东西
25,另一个分身的我,4,2023/9/22 17:57,广西,13,感觉还可以，玟小六变成小夭后，变得不那么快乐了，还是当男人随心所欲不被审判啊
25,奶油泡芙,5,2024/2/20 17:09,湖南,1,好看杨紫出品还是精品
25,史妖妖,3,2023/9/4 13:56,陕西,12,果然是不适合，这居然才是第一部……演一半这种确实看的人难受
25,法号天真,2,2024/1/6 19:47,浙江,11,剧情节奏慢，男主的表情和台词有点奇怪，就是很明显能让你感觉到他在演，很出戏。
25,支支吾吾了了,3,2023/10/18 23:46,山东,8,没看完，不喜欢相柳那个角色
25,原来是富婆呀！,5,2024/1/5 16:19,江苏,4,期待第二部
25,王哲z,5,2024/1/3 22:13,湖南,4,巨巨巨好看2023最上头的剧，我妈安利我看的！！太好看啦！！！
25,Kilua迷妹,5,2023/10/1 22:08,湖北,17,我已掉入夭柳深坑，be是种美学，玻璃渣里找糖，很好看
25,初夏,4,2023/10/1 14:16,北京,8,陷入了十七的深情中，不能自拔。
25,flower,4,2023/10/7 13:13,湖南,9,相柳意难平
25,qxygr,3,2024/2/6 13:31,江西,3,我是天下出身最高贵的女子，我经历凄惨，未来的天下至主是我哥哥，他爱我他虐我，天下最有钱的人是我捡到的，他爱我爱的要死，天下武力最强的妖族爱我，他随时可为我舍命，好土，我好爱，再次感叹，有个有演技的女演员真好
25,恺音Kyin,4,2024/1/6 17:19,云南,7,长相思，思相柳
25,说好了不动情,4,2024/1/24 9:05,浙江,6,玱玹到底是近视多少度，十几集才发现小六是他的妹妹，相柳也真是的，九个头没有一张嘴能开口的，没想到柳柳蛇这么早就喜欢上小夭了，总体来说还行吧
25,Jolizz,4,2024/1/21 11:47,上海,15,不喜欢璟，喜欢相柳那隐忍而强大的爱
25,饭思哲,3,2023/10/2 4:50,加拿大,7,磕错cp了，就算不是相柳也该是哥哥啊？现在就是吃了翔的心情
26,smilefish,3,2024/2/4 4:07,泰国,1,结局这……经常连不起来或中断的剧情，我竟然还是连日看完了
26,何袖,5,2023/8/6 14:45,山西,634,刚开始到时候，就想让女主一人舞事业登基，然后allin！！！管他表哥狐狸还是九头妖大将军，全部收入囊中！！！（捂脸行吧这个不现实）追到现在完全对相柳怜爱了，暴风哭泣，檀多多诠释的太细腻了！！！垂直入坑檀健次，考古一个礼拜了还是停不下来，现在到处找各位太太的粮，太太们，饿饿，饭饭。。。
26,大树之后,4,2023/9/23 10:23,贵州,26,三倍速看完，檀健次演技真不错，几位年轻演员演技都挺好，就是剧情有点太老套
26,momo,3,2024/1/14 16:35,湖南,0,剧情我没啥好说的，都2023年了女主的人设居然还是周转于几个强大男人之间的“宝物”。。前面清水镇小六时期好一点，王姬部分就是完全。。。唯一一点好是涂山璟那个人设确实太绝了。
26,爱尔那尼,3,2024/2/4 1:04,江苏,4,三对爱情满足了大多数女孩的感情幻想。官配太磨叽太甜，不太get到；表哥表妹骨科我爱，也是那句“我想和你长相守有错吗？”吸引来看的；柳夭虐恋我爱，虐天虐地虐我大爱。张晚意和檀健次演的好??。看过张晚意几部正剧，没想到古偶扮相挺好看，年轻帝王的感觉拿捏很好。檀健次是第一次看，出乎意料，相柳人设太好了，但他的演技给人设增加好感度爆表。
26,元姀,3,2023/10/8 8:04,加纳,2,我比较磕小夭和表哥之间相依为命的情感，夭璟和夭柳的相处过程中我总控制不住想：这样不平等的亲密关系真能健康存在的吗？其他情节也比较古早小儿科，服化道很漂亮，主演演技及格。
26,江雪一碗酒,3,2023/9/14 9:53,江苏,7,相柳是帅的，但是年纪大了嗑不了一点这种隐忍成全爱在心口难开，学学隔壁17长点嘴吧
26,Momo,1,2023/7/29 18:36,广东,5,很喜欢书所以去瞥了一眼明知不会好看的剧果然：国产男明星个比个的瘦鸡看上去贫血肾虚毫无美感演技烂得自不必说连花瓶都当不了杨紫不适合演小夭国产剧情编写个比个的烂而无聊废话连篇装腔作势快进都看不下去导演运镜美吗？？不美服化道也并不高级都是千篇一律的降智古偶罢了靠着这些中国观众的审美可以继续疯狂倒退毫无下线他们的钱也更好赚啦！只能说：yue透了yue！yue！yue！
26,颜颜,4,2024/4/27 20:31,上海,3,演员演技在线、颜值在线。发现檀健次宝藏男孩一枚，扮相绝美、演技令人动容。期待第二季吧！
26,momo,3,2023/7/31 21:07,河北,0,杨紫yyds，，继香蜜沉沉烬如霜之后第二部好看的仙侠剧?????———后面剧情不如清水镇，有点拖沓，先扣一星，男二角色有点工具人了，特效不太好，三星半吧
26,迷宫,4,2024/3/12 16:35,河南,2,看了几集，这剧作质量惊到我了，剧情是有点古早，bgm也不太好听，但这都是小瑕疵，主要是剧本演技都非常给力啊
26,搁浅还划水,5,2023/9/6 16:26,山东,35,杨紫演技牛逼，太厉害了，认错娘那里看哭我，夭璟太甜啦
26,·京極Kyōko·,3,2024/4/3 2:21,英国,2,剧情真的好癫啊……但檀健次不错
26,就这样怎么着,5,2023/8/26 14:21,甘肃,71,第一部看完去看原著了，总的来说几位演员演的让我很自然的在看书的过程中带入了，整部剧看似谈情说爱，但是最后所有人都在爱情和其他之间选择了放弃爱情，所以这整部剧立意很高
26,?,2,2023/8/11 19:42,贵州,642,厕品导演编剧宣发创作出来的厕品工业糖精恋综情景剧。一星给清水镇一星给玟小六等少数几个演员，已经是宽容的给法了。
26,林羡,5,2023/9/27 19:35,辽宁,7,要看第二部快点开始吧
26,WJy7,3,2023/9/10 12:29,山东,15,第一次get到邓为的帅！！！这样的忠心帅气有才华又多金的小奶狗谁不喜欢呢！但是，他说的很多话太像画大饼了，要我我也会生气！人生在世，别被太多东西束缚，不然会伤害自己，更会伤害你爱的人。
26,汤圆圆,3,2023/9/15 20:05,广东,0,因这部戏成为了多多的粉丝。看完书之后觉得，另外一个适合相柳的演员是汪铎，蛇系脸，身形高大，眼神冷漠，更有神魔不可方物的冷血疏离感。多多本质是个甜哥，和小夭的互动偶尔有人夫感，就是汪铎的演技估计没有多多自然且有细节。
26,比干,5,2023/7/29 13:38,浙江,2425,我求求了相柳能不能是男主
26,趣多多姑娘°,4,2023/9/10 9:03,江苏,17,这个结局我喜欢，喜欢张晚意。
27,月牙SoulMoon,5,2023/10/1 20:33,广西,10,邓为-涂山璟，让理想的爱人的形象在外在和内在均得以具化。他经历了巨大的灾难，但仍然对世界报之以歌，有顶尖的谋略，却不参与权势的争夺，高贵而谦卑，慈悲而智慧，乃人间妄想也。虽这个世界破破烂烂，但这样完美的形象，永存于向往真爱的每个人内心那个美好的角落里。
27,like Journey,4,2023/8/29 14:35,安哥拉,81,四星都给戏份不多但逢出场即是高光的相柳，赞檀健次的演技和原声台词，眼波流转的各种眼神戏真的太精彩了~唱的两首ost也很好听，此外，外形和服道化跟原著中角色的契合度也很高，感谢演员本人和团队的用心，演活了我心中的相柳
27,乐乐小乐,4,2023/9/17 14:29,上海,18,期待一下第二季吧～
27,siddhar,3,2023/10/13 21:11,上海,21,看了一半弃剧。古偶没少看，第一次被官配的感情戏膈应到……除了这点啥都好，但是这一点太要命了。3分给除此以外的其他。
27,爱做白日梦的七,2,2024/4/18 15:06,浙江,0,说一下为什么只打2星，毕竟它豆瓣7.8了。按理说她应该是大女主剧，但是杨紫的外貌不行，剧情也更加配不上什么大女主，女主压根撑不起来，然后元素很多，但是剧情稀碎，一个元素也没讲好。杨紫的演技是OK的，但是颜值真的一般，我希望下次有别的大美女演这种剧情，然后这部剧男主们的颜值可以。
27,板烧番茄鱼,3,2024/2/16 20:09,广东,1,看了半天没有什么映像深的桥段，古偶只剩下靠感情反复推拉拽扩充剧情了
27,蜗牛淇水汤汤,5,2023/8/7 16:03,重庆,355,啊啊啊！！！嗑到了，咋那么好看啊！女主加三个男主我都喜欢～
27,西原,4,2023/8/27 15:37,陕西,28,我真的是好爱涂山璟。要有多么强大才能在经历一切后还拥有一颗柔软的包容一切的心。如果要用很短的话概括他，我觉得是“心软的神”，涂山璟的身上真的是有神性的。看到有人说“小夭从来没有见过真正的涂山璟”，私以为然。那个信手拂弦便能风流冠绝天下，随口调侃“静夜幽兰香”，手谈一局引得老西炎王感叹“幸好你志不在此”的，风姿卓绝的青丘公子，在与小夭相遇前就被涂山篌打碎了。很多人说，看不到璟的主线，作为一个涂山璟毒唯，我觉得在看的是他被打碎后重新黏合的过程。在这个过程里，爱情帮助他重建。这可能也是很多人觉得他太弱的原因，因为以往的言情剧，更多依靠爱情重建自我的是女主。涂山璟太美好了，他是神性、动物性（雄竞）、人性（甚至男性与女性统一）的和谐。有人说涂山璟是桐华写给女孩子一封情书，。他怎么不是呢？！
27,驼背小老太太,2,2024/3/26 21:49,北京,4,妈呀，没看过小说啥的，这没拍完啊，白看
27,最好,3,2023/9/30 5:36,浙江,3,还行吧，就是我觉得好几个人台词有点尴尬看到19集看不下去了，看得好累，没有吸引我看下去的地方，而且女配人设感觉好扁平化啊，阿念馨悦都是那种出身高贵就看不起人任性的性格，而且也没个人教他们这样做是不对的……防风目前看着也是为了爱情的女反派性格也不好，就是那种浓浓的跟女主对面的都不是啥好人的感觉……不想看了，特效看着好像还行
27,态度端正要努力,5,2023/8/22 21:11,浙江,135,没有办法不给五分毕竟那是相柳啊?
27,寻水的鱼,4,2023/12/25 23:44,北京,3,看了十多集了，我还是没有明白小夭的人设，怕寂寞？被伤害不敢爱？过于坚强依靠自己？没看清楚，总之就是编剧给安排了F4。邓为饰演的涂山璟很帅，天真又儒雅的帅气，很合我心，那双手，尤其好看。看完才发现，这才是第一季呀，好戏还在后面呢。玱玹、璟、相柳、丰隆，小夭好幸运。解锁长相思F4，太帅！
27,阳光正好,4,2024/3/4 9:15,河南,0,卡司很强大，图山璟太好了
27,爱哦,3,2023/9/11 8:47,北京,20,一晚上看完了，后面快进，没人不喜欢相柳吧
27,momo,4,2023/7/25 2:31,吉林,1,前半段比后半段好看，cp磕的我上火，为啥不能五个人和和美美生活在一起
27,Yucatan归来了,3,2024/4/8 20:49,山东,1,好传统的内核啊
27,Savi,5,2024/4/26 22:40,新疆,3,质疑纣王理解纣王成为纣王
27,男性向恋爱番亖,1,2023/7/26 11:18,广西,4,质子咋还能带着公主到处游山玩水？女主反驳说书的话，不分明还有记忆吗？忘记了自己是谁，可是又知道那些事，她不去查清楚吗？不分男女，只分公母的话，女主在别人眼里不还得算公的。强制加入的工业糖精很明显，比如喂药为什么不能一个人扶着，一个人喂，因为女主一个人背后搂着，亲密度更多，甜度更高。为什么就一个硬收来的手下毒师，就值得相柳和她一起坐在鸟上谈心，还是因为她是女主。特效真的很拉，不管是冰钉，还是刀刃抵在脖子上的画面都很好笑。我还以为是质子要假意巴结公主才好过，结果是什么找不到小夭就加倍补偿给二公主的戏码，真是?而且为什么直接就能把老鸨抬价的事和相柳联系上阿？女主又在发癫了，这都原谅相柳，还对剖心谈话，然后腿又断了。心甘情愿被虐就不算虐女了吗？你们清水镇到底卧虎藏龙在哪里？
27,梦想高飞,5,2023/8/26 11:21,黑龙江,39,5星必须5星等不及看第二部了！坚定的人太迷人了！
27,starry starry,1,2024/2/6 11:37,广东,7,这剧分成两季播是给机会让我看清这剧的实质，一星不谢。//8.10被导演创飞，前半篇最高潮的一场戏拍成了笑料，还能给好评完全是因为夭璟木樨园热恋还行。//剧第一天上线看完我还能激情输出评价，跟着剧情渐渐深入我的反射弧终于让我想起去年我多爱小夭涂山璟这对小情侣，今晚看到鱼丹紫这集我已疯，啥也不想说了，夭璟她们超爱，我超爱夭璟！
28,今天辞职了吗,5,2024/3/26 20:25,北京,2,相柳的部分我投到大屏原速仔细观看，涂山璟部分在手机上三倍速，苍玄部分根据剧情而定，其它部分五倍速。虽然相柳这条线绝对be，但是还是站相柳！而且檀健次古装居然这么帅！不过杨紫和桐华，老搞这种大家都爱我但大家都虐我的故事。(陷进去了，又原速看了一遍，改成五星了，不仅相柳虐，苍玄那条线也大虐啊）
